{
  "schema_version": "1.0.0",
  "mapping_id": "map-demo-co",
  "membrane_org_id": "org-demo-co",
  "membrane_project_id": "proj-demo-co-support",
  "agenttwin_org_id": "01a18c71-9d00-demo-org",
  "agenttwin_project_id": "01a18c71-9d01-7b04-932b-2c14a50d0953",
  "agenttwin_base_url": "http://localhost:8080",
  "credential_ref": "agenttwin/demo-api-key",
  "status": "active",
  "created_at": "2026-10-30T10:50:00Z",
  "updated_at": "2026-10-30T10:50:00Z",
  "actor": "owner@demo.agenttwin.dev",
  "audit_ref": "audit-map-demo-co",
  "default_agent_id": "support-refund-agent"
}
